{
  "version": "v1",
  "generatedAt": "2026-03-21T07:46:05.158Z",
  "date": "2026-03-10",
  "count": 12,
  "runs": [
    {
      "id": "Qwen_Qwen3-235B-A22B-Instruct-2507_audit_results_20260310_003316",
      "filename": "Qwen_Qwen3-235B-A22B-Instruct-2507_audit_results_20260310_003316.json",
      "dataUrl": "../../../../data/Qwen_Qwen3-235B-A22B-Instruct-2507_audit_results_20260310_003316.json",
      "model": "Qwen/Qwen3-235B-A22B-Instruct-2507",
      "timestamp": "2026-03-10T00:33:16Z",
      "providerEntries": [
        {
          "endpoint": "alibaba",
          "provider": "alibaba",
          "variant": null,
          "metrics": {
            "exact_match_rate": 0.8797797108705175,
            "avg_prob": 0.8090151122436718,
            "avg_margin": 0.11289124778415092,
            "avg_logit_rank": 0.1826146817698229,
            "avg_gumbel_rank": 0.1826146817698229,
            "infinite_margin_rate": 0.007635020965016584,
            "total_tokens": 15979,
            "n_sequences": 100,
            "fireworks_verification_mode": "on-demand",
            "serverless_error": "Error code: 404 - {'error': {'message': 'Model not found, inaccessible, and/or not deployed', 'param': 'model', 'code': 'NOT_FOUND', 'type': 'error'}, 'request_id': 'redacted'}"
          }
        },
        {
          "endpoint": "atlas-cloud/fp8",
          "provider": "atlas-cloud",
          "variant": "fp8",
          "metrics": {
            "exact_match_rate": 0.9550463856546915,
            "avg_prob": 0.843946865297057,
            "avg_margin": 0.018401157098867527,
            "avg_logit_rank": 0.040159392316792226,
            "avg_gumbel_rank": 0.040159392316792226,
            "infinite_margin_rate": 0.00006226262374696469,
            "total_tokens": 16061,
            "n_sequences": 100,
            "fireworks_verification_mode": "on-demand"
          }
        },
        {
          "endpoint": "deepinfra/fp8",
          "provider": "deepinfra",
          "variant": "fp8",
          "metrics": {
            "exact_match_rate": 0.9577447180897612,
            "avg_prob": 0.8422971214429159,
            "avg_margin": 0.015849865160264424,
            "avg_logit_rank": 0.03637954744343043,
            "avg_gumbel_rank": 0.03637954744343043,
            "infinite_margin_rate": 0.00006250781347668459,
            "total_tokens": 15998,
            "n_sequences": 100,
            "fireworks_verification_mode": "on-demand"
          }
        },
        {
          "endpoint": "google-vertex",
          "provider": "google-vertex",
          "variant": null,
          "metrics": {
            "exact_match_rate": 0.9479024873159263,
            "avg_prob": 0.8395909006035357,
            "avg_margin": 0.024995267848680443,
            "avg_logit_rank": 0.0517881450315555,
            "avg_gumbel_rank": 0.0517881450315555,
            "infinite_margin_rate": 0.0003712411830219032,
            "total_tokens": 16162,
            "n_sequences": 100,
            "fireworks_verification_mode": "on-demand"
          }
        },
        {
          "endpoint": "hyperbolic",
          "provider": "hyperbolic",
          "variant": null,
          "metrics": {
            "exact_match_rate": 0.9629191812356125,
            "avg_prob": 0.8436567490873317,
            "avg_margin": 0.011843843208491476,
            "avg_logit_rank": 0.030796988738878865,
            "avg_gumbel_rank": 0.030796988738878865,
            "infinite_margin_rate": 0.00006221613886642194,
            "total_tokens": 16073,
            "n_sequences": 100,
            "fireworks_verification_mode": "on-demand"
          }
        },
        {
          "endpoint": "novita/fp8",
          "provider": "novita",
          "variant": "fp8",
          "metrics": {
            "exact_match_rate": 0.9592962667810948,
            "avg_prob": 0.8438000700715192,
            "avg_margin": 0.016882885547593502,
            "avg_logit_rank": 0.03714828664255502,
            "avg_gumbel_rank": 0.03714828664255502,
            "infinite_margin_rate": 0.0001839024091215595,
            "total_tokens": 16313,
            "n_sequences": 100,
            "fireworks_verification_mode": "on-demand"
          }
        },
        {
          "endpoint": "siliconflow/fp8",
          "provider": "siliconflow",
          "variant": "fp8",
          "metrics": {
            "exact_match_rate": 0.9539392442578415,
            "avg_prob": 0.8419249117255734,
            "avg_margin": 0.021718427917129888,
            "avg_logit_rank": 0.045937268461348484,
            "avg_gumbel_rank": 0.045937268461348484,
            "infinite_margin_rate": 0.0003087182020251914,
            "total_tokens": 16196,
            "n_sequences": 100,
            "fireworks_verification_mode": "on-demand"
          }
        },
        {
          "endpoint": "together",
          "provider": "together",
          "variant": null,
          "metrics": {
            "exact_match_rate": 0.96440489432703,
            "avg_prob": 0.8488246186063966,
            "avg_margin": 0.011526032814431398,
            "avg_logit_rank": 0.028982820417748117,
            "avg_gumbel_rank": 0.028982820417748117,
            "infinite_margin_rate": 0.00012359411692003462,
            "total_tokens": 16182,
            "n_sequences": 100,
            "fireworks_verification_mode": "on-demand"
          }
        },
        {
          "endpoint": "wandb/bf16",
          "provider": "wandb",
          "variant": "bf16",
          "metrics": {
            "exact_match_rate": 0.9622031580256123,
            "avg_prob": 0.8436082019357733,
            "avg_margin": 0.013913176957035379,
            "avg_logit_rank": 0.03431555389779933,
            "avg_gumbel_rank": 0.03431555389779933,
            "infinite_margin_rate": 0.0001864975755315181,
            "total_tokens": 16086,
            "n_sequences": 100,
            "fireworks_verification_mode": "on-demand"
          }
        }
      ],
      "parameters": {
        "n_prompts": 100,
        "max_tokens": 200,
        "seed": 42,
        "top_k": 50,
        "top_p": 0.95,
        "temperature": 0,
        "verification_backend": "fireworks",
        "fireworks_verification_mode": "on-demand",
        "fireworks_verification_strategy": "fixed-per-audit",
        "fireworks_deployment_created_for_audit": true,
        "fireworks_serverless_mapping_error": null
      }
    },
    {
      "id": "moonshotai_Kimi-K2-Thinking_audit_results_20260310_005626",
      "filename": "moonshotai_Kimi-K2-Thinking_audit_results_20260310_005626.json",
      "dataUrl": "../../../../data/moonshotai_Kimi-K2-Thinking_audit_results_20260310_005626.json",
      "model": "moonshotai/Kimi-K2-Thinking",
      "timestamp": "2026-03-10T00:56:26Z",
      "providerEntries": [
        {
          "endpoint": "atlas-cloud/int4",
          "provider": "atlas-cloud",
          "variant": "int4",
          "metrics": {
            "exact_match_rate": 0.8831221904372701,
            "avg_prob": 0.8371113629867533,
            "avg_margin": 0.1465807769224816,
            "avg_logit_rank": 0.1906416019615856,
            "avg_gumbel_rank": 0.1906416019615856,
            "infinite_margin_rate": 0.008990600735594606,
            "total_tokens": 19576,
            "n_sequences": 100,
            "fireworks_verification_mode": "serverless"
          }
        },
        {
          "endpoint": "baseten/fp4",
          "provider": "baseten",
          "variant": "fp4",
          "metrics": {
            "exact_match_rate": 0.9304723209751142,
            "avg_prob": 0.8769811209334795,
            "avg_margin": 0.06620763728199879,
            "avg_logit_rank": 0.08476383951244286,
            "avg_gumbel_rank": 0.08476383951244286,
            "infinite_margin_rate": 0.0003555104113763332,
            "total_tokens": 19690,
            "n_sequences": 100,
            "fireworks_verification_mode": "serverless"
          }
        },
        {
          "endpoint": "deepinfra/fp4",
          "provider": "deepinfra",
          "variant": "fp4",
          "metrics": {
            "exact_match_rate": 0.9307902458767581,
            "avg_prob": 0.8772215851011806,
            "avg_margin": 0.05459286459567748,
            "avg_logit_rank": 0.10017201254679753,
            "avg_gumbel_rank": 0.10017201254679753,
            "infinite_margin_rate": 0.006071031063442275,
            "total_tokens": 19766,
            "n_sequences": 100,
            "fireworks_verification_mode": "serverless"
          }
        },
        {
          "endpoint": "google-vertex",
          "provider": "google-vertex",
          "variant": null,
          "metrics": {
            "exact_match_rate": 0.9277435522606244,
            "avg_prob": 0.8681493205748639,
            "avg_margin": 0.05880326157963707,
            "avg_logit_rank": 0.11444084786467579,
            "avg_gumbel_rank": 0.11444084786467579,
            "infinite_margin_rate": 0.006787094079565626,
            "total_tokens": 19154,
            "n_sequences": 100,
            "fireworks_verification_mode": "serverless"
          }
        },
        {
          "endpoint": "moonshotai/int4",
          "provider": "moonshotai",
          "variant": "int4",
          "metrics": {
            "exact_match_rate": 0.9674444670878337,
            "avg_prob": 0.8979489884741828,
            "avg_margin": 0.014904097243452563,
            "avg_logit_rank": 0.03235174240880375,
            "avg_gumbel_rank": 0.03235174240880375,
            "infinite_margin_rate": 0.00010189525168127165,
            "total_tokens": 19628,
            "n_sequences": 100,
            "fireworks_verification_mode": "serverless"
          }
        },
        {
          "endpoint": "nebius/fp8",
          "provider": "nebius",
          "variant": "fp8",
          "metrics": {
            "exact_match_rate": 0.9593325849576487,
            "avg_prob": 0.8934122679352301,